title,price,description,url,brand
Pincel Para Pó Cónico Grande O128 - Daymakeup,"R$ 59,00","Pincel Para Pó Cônico Grande O128 - Daymakeup Descrição do Produto
O Pincel Para Pó Cônico Grande O128 da Daymakeup é ideal para aplicação e mistura de produtos em pó no rosto e nos olhos. Com um design profissional, este pincel foi desenvolvido para proporcionar um acabamento impecável e uniforme, perfeito para bases minerais, blushes, iluminadores e até mesmo para selar produtos com pó translúcido. Características
Cerdas macias e densas : Uma combinação de fibras naturais e sintéticas que garantem aplicação uniforme e suave. Design cônico : Perfeito para alcançar áreas delicadas, como ao redor dos olhos e nariz, além de proporcionar maiores soluções. Virola patenteada : Garante maior durabilidade e resistência, além de oferecer um design sofisticado. Versatilidade : Indicado tanto para o rosto quanto para os olhos, ideal para misturar e aplicar diferentes tipos de pó.
Indicação de Uso
Aplicação de produtos em pó , como bases minerais, blushes e iluminadores. Mistura e finalização com pós translúcidos para um acabamento natural e profissional.
Como usar
Aplique o produto em pó diretamente no pincel. Para o rosto, utilize movimentos circulares ou de varredura para se espalhar uniformemente. Nos olhos, utilize o formato cônico para alcançar áreas mais delicadas, garantindo resultados na aplicação e mistura.
Composição
Cerdas Naturais e Sintéticas Premium : Alta performance e durabilidade. Cabo Ergonômico de Madeira : Oferece conforto e controle. Virola de Alumínio Patenteado : Resistente e com design exclusivo.
Com o Pincel Para Pó Cônico Grande O128 , eleve sua maquiagem a um novo nível de sofisticação e perfeição!",https://www.sunsetcosmeticos.com.br/produto/pincel-para-po-conico-grande-o128-daymakeup-3619,daymakeup
